{
  "schemaVersion": "ruleoak.governance.v1",
  "recordType": "ReportRecord",
  "reportId": "py-report-001",
  "runId": "py-run-001",
  "title": "Python SDK Governance Report",
  "summary": "Python-emitted governance records passed RuleOak protocol validation.",
  "createdAt": "2026-01-01T00:00:30.000Z",
  "records": [
    "py-run-001",
    "py-decision-001",
    "py-evidence-001",
    "py-approval-001",
    "py-event-001"
  ],
  "metadata": {
    "emittedBy": "ruleoak-py",
    "protocol": "ruleoak.governance.v1"
  }
}
