{
  "schemaVersion": "ruleoak.governance.v1",
  "recordType": "ReportRecord",
  "reportId": "roak-report-golden-001",
  "runId": "roak-run-golden-001",
  "title": "Golden Governance Report",
  "summary": {
    "allowed": 1,
    "approvalRequired": 1,
    "blocked": 1
  },
  "records": [
    "roak-evidence-golden-001",
    "roak-approval-golden-001"
  ],
  "metadata": {
    "fixture": true
  },
  "createdAt": "2026-01-01T00:00:00.000Z"
}