{
  "schemaVersion": "ruleoak.governance.v1",
  "recordType": "ReportRecord",
  "reportId": "conformance-report-001",
  "runId": "conformance-run-001",
  "title": "RuleOak Governance Protocol v1 Conformance Report Fixture",
  "summary": {
    "allowed": 1,
    "approvalRequired": 1,
    "approved": 1,
    "blocked": 0
  },
  "records": [
    "conformance-run-001",
    "conformance-evidence-001",
    "conformance-decision-allow-001",
    "conformance-decision-approval-001",
    "conformance-approval-001",
    "conformance-audit-001",
    "conformance-audit-002",
    "conformance-audit-003"
  ],
  "metadata": {
    "fixture": true
  },
  "createdAt": "2026-01-01T00:00:00.000Z"
}
